[
  {
    "schema": "case/v1",
    "title": "Underperformer on a hybrid ESG project",
    "domain": "Process",
    "topic": "Hybrid delivery",
    "difficulty": "hard",
    "scenario": "You are leading a hybrid (agile + predictive) digital-transformation project for a retailer aiming to cut its carbon footprint by 30% while lifting revenue through AI-personalised recommendations. A key developer on the agile stream has missed three sprints' deliverables, hurting the MVP timeline and stakeholder confidence. The project must stay aligned with corporate ESG goals and deliver measurable business value within budget.",
    "steps": [
      {
        "label": "Business Environment focus",
        "prompt": "The sponsor worries the delays could threaten the organisation's sustainability targets and market position. What should you do first?",
        "correct": [
          {
            "text": "Analyse the impact on overall value delivery, benefits realisation and strategic alignment with the ESG objectives",
            "why": "Start by understanding the business impact — value and benefits — before choosing an action; that frames every later decision."
          }
        ],
        "distractors": [
          { "text": "Immediately request a resource replacement from HR", "trap": "Jumps to removal before assessing impact, root cause or support options." },
          { "text": "Escalate straight to the steering committee for a go/no-go decision", "trap": "Premature escalation before you've analysed the situation or exhausted PM actions." },
          { "text": "Reassign the developer to non-critical predictive tasks without further assessment", "trap": "An impulsive reshuffle that ignores value, cause and team impact." }
        ],
        "explanation": "In the Business Environment lens, assess impact on value, benefits and strategic (ESG) alignment first — that judgement drives the right response.",
        "domain": "Business Environment"
      },
      {
        "label": "People + Process",
        "prompt": "After 1:1s and coaching there's still no improvement, and no skills gap that training would fix. The team runs Kanban. What is the next best action to protect outcomes?",
        "correct": [
          {
            "text": "Agree a formal performance improvement plan with measurable goals tied to flow and business-value metrics",
            "why": "With coaching exhausted, formalise expectations and support through a documented PIP before any escalation."
          }
        ],
        "distractors": [
          { "text": "Review the developer's performance publicly in the daily standup to drive accountability", "trap": "Public criticism damages safety and morale — never call someone out in front of the team." },
          { "text": "Ignore the short-term delays because agile is flexible", "trap": "Agility is not an excuse to let repeated missed commitments slide." },
          { "text": "Shift the entire workstream to predictive planning", "trap": "A disproportionate change of approach that doesn't address the performance issue." }
        ],
        "explanation": "The documented PIP is the next formal, fair step once coaching hasn't worked — tied here to flow and value, not just activity.",
        "domain": "People"
      },
      {
        "label": "Integrated approach",
        "prompt": "The functional manager suggests reassigning the developer permanently. Given the hybrid nature and sustainability goals, what should you prioritise in your recommendation?",
        "correct": [
          {
            "text": "Evaluate reassignment against value delivery, team morale, knowledge retention and alignment with long-term ESG and AI-capability goals",
            "why": "An integrated decision weighs value, people and strategy together — not just the immediate schedule."
          }
        ],
        "distractors": [
          { "text": "Focus solely on recovering the schedule", "trap": "A single-axis view that ignores value, people and strategy." },
          { "text": "Accept the reassignment immediately to avoid further escalation", "trap": "Conflict-avoidance rather than a reasoned, value-based decision." },
          { "text": "Request AI tools to automate the developer's tasks as a replacement", "trap": "A gimmick that dodges the real people and capability questions." }
        ],
        "explanation": "Integrated thinking balances schedule, value, team morale, knowledge retention and strategic ESG/AI goals.",
        "domain": "Process"
      }
    ],
    "references": ["PMBOK Guide Seventh Edition — Team & Stakeholder performance domains"],
    "tags": ["hybrid", "people", "esg", "case"]
  }
]
